{
  "attestation_type": "INDEPENDENT_REPLAY_ATTESTATION_V1",
  "receipt_id": "RECEIPT_CONNECTOR_POLICY_001",
  "node_id": "node_alpha",
  "result": "CONFIRMED_DIVERGENCE",
  "timestamp": "2026-05-16T14:30:00Z",
  "signature": "a1b2c3d4e5f6789012345678901234567890abcdef1234567890abcdef123456",
  "witness_hash": "sha256:5d41402abc4b2a76b9719d911017c592",
  "replay_log_ref": "logs/node_alpha/replay_20260516_143000.log"
}
